{
  "$schema": "https://json-schema.org/draft/2020-12/schema",
  "$id": "urn:motion-machine:contracts:story",
  "title": "Motion Machine story (SPEC §4): the beat sheet as data",
  "type": "object",
  "additionalProperties": false,
  "required": [
    "id",
    "kind",
    "formats",
    "title",
    "language",
    "facts",
    "audio",
    "scenes",
    "cta"
  ],
  "properties": {
    "id": {
      "type": "string",
      "pattern": "^[a-z][a-z0-9-]{1,60}$"
    },
    "kind": {
      "type": "string",
      "enum": [
        "film",
        "deck",
        "loop"
      ],
      "description": "loop: a film of 4 to 15 s whose last frame is its first (G-LOOP); scheduled and drawn as a film"
    },
    "generator": {
      "type": "string",
      "pattern": "^(?![A-Za-z]:)(?!.*(^|/)\\.\\.(/|$))[A-Za-z0-9._-]+(/[A-Za-z0-9._-]+)*\\.m?js$",
      "description": "the repo-relative path of the script that writes this story; the studio opens it read-only and mm timeline refuses to edit it (edit the generator's input instead)"
    },
    "autoReturn": {
      "type": "boolean",
      "description": "a loop only. Over the last min(1.2 s, 15 %) the kit plays each arrived beat of the last scene back to p = 0, last arrival first, ending on the last exported frame, so the loop ends on its first frame; instant beats stay"
    },
    "platform": {
      "enum": ["reels", "tiktok", "shorts"],
      "description": "the app a 9x16 film is made for; G-EDGE keeps text out of the UI it draws (bottom 500 px, right 120 px)"
    },
    "formats": {
      "type": "array",
      "minItems": 1,
      "uniqueItems": true,
      "items": {
        "type": "string",
        "enum": [
          "9x16",
          "1x1",
          "4x5",
          "16x9"
        ]
      }
    },
    "title": {
      "type": "string",
      "minLength": 1,
      "maxLength": 120
    },
    "language": {
      "type": "string",
      "pattern": "^[a-z]{2}(-[A-Z]{2})?$"
    },
    "facts": {
      "type": "array",
      "items": {
        "type": "object",
        "additionalProperties": false,
        "required": [
          "id",
          "text",
          "source"
        ],
        "properties": {
          "id": {
            "type": "string",
            "pattern": "^f[0-9]{1,3}$"
          },
          "sample": {
            "type": "boolean",
            "description": "the number is illustrative, not measured; G-FACT-REF then needs a visible element with data-sample and text (such as \"Illustrative\") at every rest where a beat citing it shows"
          },
          "text": {
            "type": "string",
            "minLength": 1
          },
          "source": {
            "type": "string",
            "minLength": 1,
            "description": "where the fact comes from; a human checks it against this (H-FACTS)"
          }
        }
      }
    },
    "audio": {
      "type": "object",
      "additionalProperties": false,
      "required": [
        "track",
        "bpm",
        "beats"
      ],
      "properties": {
        "track": {
          "type": [
            "string",
            "null"
          ],
          "pattern": "^(?!https?:)[^\\s]+\\.(wav|mp3|m4a|flac)$"
        },
        "bpm": {
          "type": [
            "integer",
            "null"
          ],
          "minimum": 50,
          "maximum": 200
        },
        "beats": {
          "type": [
            "string",
            "null"
          ],
          "pattern": "^(?!https?:)[^\\s]+\\.json$"
        }
      }
    },
    "scenes": {
      "type": "array",
      "minItems": 1,
      "maxItems": 40,
      "items": {
        "type": "object",
        "additionalProperties": false,
        "required": [
          "id",
          "layout",
          "move",
          "beats",
          "say"
        ],
        "anyOf": [
          {
            "required": [
              "cut"
            ],
            "properties": {
              "cut": true
            }
          },
          {
            "required": [
              "position"
            ],
            "properties": {
              "position": true
            }
          }
        ],
        "properties": {
          "id": {
            "type": "string",
            "pattern": "^[a-z][a-z0-9-]{0,40}$"
          },
          "layout": {
            "$ref": "#/$defs/layoutRef"
          },
          "duration": {
            "type": "number",
            "exclusiveMinimum": 0,
            "maximum": 60,
            "description": "film only, seconds"
          },
          "presses": {
            "type": "integer",
            "minimum": 1,
            "maximum": 12,
            "description": "deck only"
          },
          "cut": {
            "$ref": "#/$defs/transitionRef",
            "description": "how this scene arrives; wins over position when both are given"
          },
          "position": {
            "type": "string",
            "enum": [
              "opening",
              "related",
              "topic",
              "climax",
              "outro"
            ],
            "description": "the scene's narrative position: without a cut, the scene arrives with style.transitions.<position>"
          },
          "move": {
            "oneOf": [
              {
                "type": "null"
              },
              {
                "$ref": "#/$defs/moveRef"
              }
            ]
          },
          "cutParams": {
            "$ref": "#/$defs/paramBag",
            "description": "params for the cut's transition pattern, over its defaults"
          },
          "variants": {
            "type": "object",
            "description": "this scene as drawn in one format, keyed by format; duration, cut and id are shared",
            "propertyNames": { "enum": ["9x16", "1x1", "4x5", "16x9"] },
            "additionalProperties": {
              "type": "object",
              "additionalProperties": false,
              "minProperties": 1,
              "properties": {
                "layout": { "$ref": "#/$defs/layoutRef" },
                "move": { "$ref": "#/properties/scenes/items/properties/move" },
                "moveParams": { "$ref": "#/$defs/paramBag" },
                "beats": { "$ref": "#/properties/scenes/items/properties/beats" },
                "say": { "type": "string" }
              }
            }
          },
          "moveParams": {
            "$ref": "#/$defs/paramBag",
            "description": "params for the scene's camera move, over its defaults"
          },
          "beats": {
            "type": "array",
            "minItems": 1,
            "maxItems": 24,
            "items": {
              "type": "object",
              "additionalProperties": false,
              "required": [
                "at",
                "slot",
                "fx"
              ],
              "properties": {
                "at": {
                  "type": "number",
                  "minimum": 0,
                  "maximum": 60,
                  "description": "seconds after the scene (film) or after the press (deck)"
                },
                "step": {
                  "type": "integer",
                  "minimum": 0,
                  "maximum": 12,
                  "description": "deck: the press that brings this beat in; 0 = present at the scene's first rest with no animation"
                },
                "until": {
                  "type": "integer",
                  "minimum": 2,
                  "maximum": 13,
                  "description": "deck: the press at which it is removed"
                },
                "out": {
                  "type": "number",
                  "minimum": 0,
                  "maximum": 60,
                  "description": "film: scene-local second at which it leaves"
                },
                "exit": {
                  "$ref": "#/$defs/exitRef"
                },
                "slot": {
                  "type": "string",
                  "pattern": "^[a-z][a-z0-9-]{0,30}$"
                },
                "fx": {
                  "oneOf": [
                    {
                      "$ref": "#/$defs/entranceRef"
                    },
                    {
                      "$ref": "#/$defs/styleEntranceRef"
                    }
                  ]
                },
                "text": {
                  "type": "string",
                  "maxLength": 400
                },
                "fact": {
                  "type": "string",
                  "pattern": "^f[0-9]{1,3}$"
                },
                "value": {
                  "type": "number"
                },
                "asset": {
                  "type": "string",
                  "pattern": "^(?!https?:)assets/[^\\s]+$"
                },
                "screen": {
                  "type": "array",
                  "maxItems": 24,
                  "description": "screen actions on the device screen this beat fills: each reduces the screen's state from the action before it; film: `at` seconds after the beat arrives; deck: `step` presses after the beat's press",
                  "items": {
                    "type": "object",
                    "additionalProperties": false,
                    "required": ["do"],
                    "properties": {
                      "do": { "type": "string", "pattern": "^screen/[a-z][a-z0-9-]{0,40}$" },
                      "at": { "type": "number", "minimum": 0, "maximum": 60 },
                      "d": { "type": "number", "exclusiveMinimum": 0, "maximum": 30 },
                      "step": { "type": "integer", "minimum": 0, "maximum": 13 },
                      "params": { "type": "object" }
                    }
                  }
                },
                "params": {
                  "type": "object",
                  "description": "pattern params: the entrance gets them, and so do the exit and the emphasis unless params.exit / params.emphasis give them their own bag",
                  "properties": {
                    "exit": {
                      "$ref": "#/$defs/paramBag"
                    },
                    "emphasis": {
                      "$ref": "#/$defs/paramBag"
                    },
                    "instant": {
                      "type": "boolean",
                      "description": "the kit's: true = the entrance takes 0 s, so the beat is finished from its at (a film's first frame shows the hook)"
                    }
                  },
                  "additionalProperties": {
                    "$ref": "#/$defs/paramValue"
                  }
                },
                "cue": {
                  "type": "string",
                  "enum": [
                    "tick",
                    "press",
                    "swipe",
                    "step",
                    "hit",
                    "riser",
                    "success",
                    "complete",
                    "bed"
                  ]
                },
                "emphasis": {
                  "$ref": "#/$defs/emphasisRef"
                }
              }
            }
          },
          "say": {
            "type": "string",
            "maxLength": 1200
          }
        }
      }
    },
    "share": {
      "type": "string",
      "maxLength": 280,
      "description": "the caption mm export writes to out/share-copy.txt: 1 to 3 sentences, postable as is; without it the hook, the closing headline and the link"
    },
    "cta": {
      "type": "object",
      "additionalProperties": false,
      "required": [
        "text",
        "url"
      ],
      "properties": {
        "text": {
          "type": "string",
          "minLength": 1,
          "maxLength": 80
        },
        "url": {
          "type": "string",
          "maxLength": 200,
          "description": "shown as text on screen; never loaded"
        }
      }
    }
  },
  "allOf": [
    {
      "if": {
        "properties": {
          "kind": {
            "enum": ["film", "loop"]
          }
        }
      },
      "then": {
        "properties": {
          "scenes": {
            "type": "array",
            "items": {
              "type": "object",
              "required": [
                "duration"
              ],
              "properties": {
                "duration": {
                  "type": "number"
                },
                "presses": false
              }
            }
          }
        }
      }
    },
    {
      "if": {
        "properties": {
          "kind": {
            "const": "deck"
          }
        }
      },
      "then": {
        "properties": {
          "scenes": {
            "type": "array",
            "items": {
              "type": "object",
              "required": [
                "presses"
              ],
              "properties": {
                "presses": {
                  "type": "integer"
                },
                "duration": false
              }
            }
          }
        }
      }
    }
  ],
  "$defs": {
    "paramValue": {
      "type": [
        "string",
        "number",
        "boolean"
      ]
    },
    "paramBag": {
      "type": "object",
      "additionalProperties": {
        "$ref": "#/$defs/paramValue"
      }
    },
    "layoutRef": {
      "type": "string",
      "pattern": "^layouts/[a-z][a-z0-9-]*$"
    },
    "transitionRef": {
      "type": "string",
      "pattern": "^transitions/[a-z][a-z0-9-]*$"
    },
    "moveRef": {
      "type": "string",
      "pattern": "^moves/[a-z][a-z0-9-]*$"
    },
    "entranceRef": {
      "type": "string",
      "pattern": "^(entrances|text|data|devices|3d)/[a-z][a-z0-9-]*$"
    },
    "styleEntranceRef": {
      "type": "string",
      "pattern": "^style:(headline|body|figure|plate)$",
      "description": "resolves to style.entrances.<role>"
    },
    "exitRef": {
      "type": "string",
      "pattern": "^exits/[a-z][a-z0-9-]*$"
    },
    "emphasisRef": {
      "type": "string",
      "pattern": "^emphasis/[a-z][a-z0-9-]*$"
    }
  }
}
