{
  "id": "gate-base-film",
  "kind": "film",
  "formats": [
    "16x9"
  ],
  "title": "G-LENGTH: the film has three scenes: 15 s, under the 20 s floor.",
  "language": "en",
  "facts": [
    {
      "id": "f1",
      "text": "The gate samples three instants for determinism.",
      "source": "SPEC.md §2.5"
    }
  ],
  "audio": {
    "track": null,
    "bpm": null,
    "beats": null
  },
  "scenes": [
    {
      "id": "open",
      "layout": "layouts/title-stack",
      "duration": 5,
      "cut": "transitions/hard-cut",
      "move": null,
      "beats": [
        {
          "at": 0,
          "slot": "headline",
          "fx": "entrances/rise",
          "text": "Time draws every frame.",
          "params": {
            "instant": true
          }
        },
        {
          "at": 1.2,
          "slot": "sub",
          "fx": "entrances/fade",
          "text": "The gate checks each rest before export.",
          "fact": "f1"
        }
      ],
      "say": "Scene 1."
    },
    {
      "id": "style",
      "layout": "layouts/title-stack",
      "duration": 5,
      "cut": "transitions/hard-cut",
      "move": null,
      "beats": [
        {
          "at": 0,
          "slot": "headline",
          "fx": "entrances/rise",
          "text": "Two halves make one style."
        },
        {
          "at": 1.2,
          "slot": "sub",
          "fx": "entrances/fade",
          "text": "Brand and motion compose per piece."
        }
      ],
      "say": "Scene 2."
    },
    {
      "id": "close",
      "layout": "layouts/title-stack",
      "duration": 5,
      "cut": "transitions/hard-cut",
      "move": null,
      "beats": [
        {
          "at": 0,
          "slot": "headline",
          "fx": "entrances/rise",
          "text": "Same t, same pixels."
        },
        {
          "at": 1.2,
          "slot": "sub",
          "fx": "entrances/fade",
          "text": "Check it, then export the piece."
        }
      ],
      "say": "Scene 5."
    }
  ],
  "cta": {
    "text": "motion-machine",
    "url": "github.com/tudorjuravlea/motion-machine"
  }
}
