{
  "id": "demo-exits-blur-out",
  "kind": "film",
  "formats": [
    "16x9",
    "9x16",
    "1x1"
  ],
  "title": "exits/blur-out demo",
  "language": "en",
  "facts": [],
  "audio": {
    "track": null,
    "bpm": null,
    "beats": null
  },
  "scenes": [
    {
      "id": "demo",
      "layout": "layouts/title-stack",
      "duration": 5,
      "cut": "transitions/hard-cut",
      "move": null,
      "beats": [
        {
          "at": 0.3,
          "slot": "headline",
          "fx": "entrances/blur-fade",
          "text": "Losing focus",
          "out": 3.2,
          "exit": "exits/blur-out"
        },
        {
          "at": 1.4,
          "slot": "sub",
          "fx": "entrances/fade",
          "text": "It softens as it goes",
          "out": 3.2,
          "exit": "exits/blur-out"
        }
      ],
      "say": "A single scene that shows exits/blur-out."
    }
  ],
  "cta": {
    "text": "motion-machine",
    "url": "github.com/tudorjuravlea/motion-machine"
  }
}
