{
  "id": "demo-transitions-grid-dissolve",
  "kind": "film",
  "formats": [
    "16x9",
    "9x16",
    "1x1"
  ],
  "title": "transitions/grid-dissolve demo",
  "language": "en",
  "facts": [],
  "audio": {
    "track": null,
    "bpm": null,
    "beats": null
  },
  "scenes": [
    {
      "id": "before",
      "layout": "layouts/title-stack",
      "duration": 3,
      "cut": "transitions/hard-cut",
      "move": null,
      "beats": [
        {
          "at": 0.3,
          "slot": "headline",
          "fx": "entrances/rise",
          "text": "Time draws every frame"
        },
        {
          "at": 1.1,
          "slot": "sub",
          "fx": "entrances/fade",
          "text": "The first scene, at rest"
        }
      ],
      "say": "The scene that leaves."
    },
    {
      "id": "after",
      "layout": "layouts/title-stack",
      "duration": 3.6,
      "cut": "transitions/grid-dissolve",
      "move": null,
      "beats": [
        {
          "at": 0,
          "slot": "headline",
          "fx": "entrances/fade",
          "text": "Nothing here moves by itself",
          "params": {
            "dur": "quick"
          }
        },
        {
          "at": 1.3,
          "slot": "sub",
          "fx": "entrances/fade",
          "text": "The second scene, at rest"
        }
      ],
      "say": "The scene that arrives through transitions/grid-dissolve."
    }
  ],
  "cta": {
    "text": "motion-machine",
    "url": "github.com/tudorjuravlea/motion-machine"
  }
}
