{
  "id": "demo-data-ring",
  "kind": "film",
  "formats": [
    "16x9",
    "9x16",
    "1x1"
  ],
  "title": "data/ring demo",
  "language": "en",
  "facts": [
    {
      "id": "f1",
      "text": "Demo figure for data/ring",
      "source": "demo fixture, an invented figure that carries no claim"
    }
  ],
  "audio": {
    "track": null,
    "bpm": null,
    "beats": null
  },
  "scenes": [
    {
      "id": "figure",
      "layout": "layouts/title-stack",
      "duration": 4,
      "cut": "transitions/hard-cut",
      "move": null,
      "beats": [
        {
          "at": 0.4,
          "slot": "headline",
          "fx": "data/ring",
          "fact": "f1",
          "params": {
            "suffix": "%"
          },
          "value": 68
        },
        {
          "at": 1.4,
          "slot": "sub",
          "fx": "entrances/fade",
          "text": "Of tasks closed this week"
        }
      ],
      "say": "The figure arrives and holds: ring."
    }
  ],
  "cta": {
    "text": "motion-machine",
    "url": "github.com/tudorjuravlea/motion-machine"
  }
}
